204116823128547328	geological_phenomenon earthquake geophysics energy natural_disaster geology phenomenon oscillation astronomy 2010_Haiti_earthquake geography instance time exist
204062469952516097	unfortunate victim comune Bondeno descent collapse watercraft ship technology Nave_industrial industrial geological_phenomenon earthquake geophysics energy natural_disaster geology phenomenon oscillation astronomy 2010_Haiti_earthquake geography
1461865817	geological_phenomenon earthquake geophysics energy natural_disaster geology phenomenon oscillation astronomy 2010_Haiti_earthquake geography Italian_region Abruzzi_e_Molise Geographical_feature time dead time moment
462669865716035585	unfortunate victim heart_failure heart_attack attack period year unit_of_time time_standard cavity cecum System period year unit_of_time time_standard lose then acquire find
204200835771678721	comune Finale_Emilia Historical_region Emilia_(region_of_Italy) descent collapse building house home Structure residential_building after last disease shock_(circulatory)
204218964706992130	being person causal_agency subjectivism subject refugee displaced_person legal_entity dead slain sad plan budget finance sales geological_phenomenon earthquake geophysics energy natural_disaster geology phenomenon oscillation astronomy 2010_Haiti_earthquake geography asterid_dicot_genus Emilia genus taxon geological_phenomenon earthquake geophysics energy natural_disaster geology phenomenon oscillation astronomy 2010_Haiti_earthquake geography
204219779253407744	danger risk event_(philosophy) management geological_phenomenon earthquake geophysics energy natural_disaster geology phenomenon oscillation astronomy 2010_Haiti_earthquake geography
204205843057618945	earthquake Harmonic_tremor defender firefighter profession laborer rescuer touch hit descent collapse disease shock_(circulatory)
1461541765	articulate ask how comprise possible after geological_phenomenon earthquake geophysics energy natural_disaster geology phenomenon oscillation astronomy 2010_Haiti_earthquake geography exist probe inquire prevent avert change death biology faith being property process_(computing) event_(philosophy) philosophy coming disease shock_(circulatory)
1474398646	geological_phenomenon earthquake geophysics energy natural_disaster geology phenomenon oscillation astronomy 2010_Haiti_earthquake geography new plan budget finance sales change death biology faith being property process_(computing) event_(philosophy) philosophy unfortunate victim geological_phenomenon earthquake geophysics energy natural_disaster geology phenomenon oscillation astronomy 2010_Haiti_earthquake geography Italian_region Abruzzi_e_Molise Geographical_feature new
462840409815666688	internal_organ heart organ terminology geological_phenomenon flood hydrology rain natural_disaster river water phenomenon Italian_region Marche name brand symbol Marketing_strategy dead slain comune Senigallia town character Miles_(Oye_Arnold!) quality power concept large_integer dozen composite_number Semiperfect_number abundant_number integer unit_of_amount being person causal_agency subjectivism subject refugee displaced_person legal_entity
1473967043	geological_phenomenon earthquake geophysics energy natural_disaster geology phenomenon oscillation astronomy 2010_Haiti_earthquake geography structure building house technology architecture architectural_structure Structure construction hardy geological_phenomenon earthquake geophysics energy natural_disaster geology phenomenon oscillation astronomy 2010_Haiti_earthquake geography descent collapse new health_facility hospital institution health_facility administrative_division prefecture jurisdiction building house home Structure residential_building assimilator student enrollee person
1462380492	geological_phenomenon earthquake geophysics energy natural_disaster geology phenomenon oscillation astronomy 2010_Haiti_earthquake geography Italian_region Abruzzi_e_Molise Geographical_feature less people nation country political_entity Political_division organization terminology Community_(Wales) slain kill destroy scrap debris Garbage_(band)
1462136062	info word European_country Italy nation country member_state_of_the_United_Nations member_state_of_the_Council_of_Europe social_state Member_state_of_the_European_Union Parliamentary_republic unitary_state geological_phenomenon earthquake geophysics energy natural_disaster geology phenomenon oscillation astronomy 2010_Haiti_earthquake geography Italian_region Abruzzi_e_Molise Geographical_feature river Maroni_(river) dead slain executive minister politician police Interior_ministry national_security part inside assert allege
204165507413315584	house_of_God church building Structure Place_of_worship tower bell_tower be fail founder transgression wickedness philosophy arrive geological_phenomenon earthquake geophysics energy natural_disaster geology phenomenon oscillation astronomy 2010_Haiti_earthquake geography
462604534226100224	cohort aged turn perish military_operation attack infarction myocardial_infarction disease Medical_emergency internal_organ heart organ terminology after mechanical_device pump tool device System pump water_pump liquid water binary_compound material ingredient chemical_compound chemical_substance comune Senigallia town Italian_region Marche prevent block medical_man physician human professional profession reach windlass capstan then
204060171876581376	adult man male gender human person sex male age Stage_(stratigraphy) switch Dead_man's_switch dead region area physical_quantity definite_integral quantity geological_phenomenon earthquake geophysics energy natural_disaster geology phenomenon oscillation astronomy 2010_Haiti_earthquake geography
204122652871372800	geological_phenomenon earthquake geophysics energy natural_disaster geology phenomenon oscillation astronomy 2010_Haiti_earthquake geography create_from_raw_material brew change damage West_Germanic German language language dialect phylum
204047087149645824	fragment bit concept artifact Terminus tool technology geological_phenomenon earthquake geophysics energy natural_disaster geology phenomenon oscillation astronomy 2010_Haiti_earthquake geography church cathedral
1476060996	geological_phenomenon earthquake geophysics energy natural_disaster geology phenomenon oscillation astronomy 2010_Haiti_earthquake geography Italian_region Abruzzi_e_Molise Geographical_feature recreation athletics exercise individual_sport Olympic_sport activity type_of_sport System express_emotion cry unfortunate victim point beginning internet .il domain_name country_code_top-level_domain Israel Generic_top-level_domain Domeny country bracket as_yet not_yet find count juvenile minor person tool pestle laboratory_equipment
204112782684196864	dead slain geological_phenomenon earthquake geophysics energy natural_disaster geology phenomenon oscillation astronomy 2010_Haiti_earthquake geography
204041269993930752	info word change damage person saint deity happy state state_of_affairs concept as_yet geological_phenomenon earthquake geophysics energy natural_disaster geology phenomenon oscillation astronomy 2010_Haiti_earthquake geography
204064182176448512	communicate inform change damage comune Moglia
204096255012511744	time dead period night language word language_unit acoustic_wave morpheme Portuguese linguistics dictionary_entry set chemical_element
1461671669	geological_phenomenon earthquake geophysics energy natural_disaster geology phenomenon oscillation astronomy 2010_Haiti_earthquake geography plan budget finance sales being person causal_agency subjectivism subject slain unfortunate victim geological_phenomenon earthquake geophysics energy natural_disaster geology phenomenon oscillation astronomy 2010_Haiti_earthquake geography precipitate spat region area physical_quantity definite_integral quantity bird_genus Aquila taxon eagle
1476144211	geological_phenomenon earthquake geophysics energy natural_disaster geology phenomenon oscillation astronomy 2010_Haiti_earthquake geography still lack bird_genus Aquila taxon eagle environment milieu as_yet exist being person causal_agency subjectivism subject
204133056481730561	asterid_dicot_genus Emilia genus taxon dead slain damage wound injury geological_phenomenon earthquake geophysics energy natural_disaster geology phenomenon oscillation astronomy 2010_Haiti_earthquake geography represent embody hideous television_season House_(season_1) episode Series_finale season
520490947511980032	torrent_stream Bisagno river use exploit period night fiction Horror_fiction genre change death biology faith being property process_(computing) event_(philosophy) philosophy provincial_capital Genoa metropolis comune city_with_hundreds_of_thousands_of_inhabitants port_city City person dweller species leave run_away structure storey building superior
204098240184983552	person deceased geological_phenomenon earthquake geophysics energy natural_disaster geology phenomenon oscillation astronomy 2010_Haiti_earthquake geography period year unit_of_time time_standard
204212101156315136	curriculum_vitae even act attempt cocktail Terremoto_(cocktail) even dead activity job labour Expressão_idiomática hypothesis
1475561776	geological_phenomenon earthquake geophysics energy natural_disaster geology phenomenon oscillation astronomy 2010_Haiti_earthquake geography criminal_law victim crime person law determine identify National_Reorganization_Process Desaparecidos_durante_el_Proceso_de_Reorganización_Nacional soldier damage wound injury
204132295769206784	have_to geological_phenomenon earthquake geophysics energy natural_disaster geology phenomenon oscillation astronomy 2010_Haiti_earthquake geography dead slain be remain alone
204058981776363521	damage wound injury geological_phenomenon earthquake geophysics energy natural_disaster geology phenomenon oscillation astronomy 2010_Haiti_earthquake geography
204260659058327553	location here Comics geological_phenomenon earthquake geophysics energy natural_disaster geology phenomenon oscillation astronomy 2010_Haiti_earthquake geography exist cause effect change damage emotion fear
520628783276380160	motor_vehicle automobile give deposit square piazza word family Kennedy_family human governance Politics_of_the_United_States enter photograph
204159165873131521	close about criminal_law victim crime person law damage wound injury
204090792137064448	volcano Cerro_Solo mountain stratovolcano demand want geological_phenomenon earthquake geophysics energy natural_disaster geology phenomenon oscillation astronomy 2010_Haiti_earthquake geography dead slain
204046931629064192	structure tower architectural_structure Structure tower clock_tower clock timekeeper clock device mechanical_device be look exist change_integrity break_down experiment test
204058816403353603	approve confirm Hominidae human hominid taxon person primate switch Dead_man's_switch dead comune Bondeno damage wound injury last_name Agostino_(name) given_name name
204049005968244737	descent collapse industrial_plant factory building business Industrial_architecture comune Bondeno geological_phenomenon earthquake geophysics energy natural_disaster geology phenomenon oscillation astronomy 2010_Haiti_earthquake geography
204073131067981824	change death biology faith being property process_(computing) event_(philosophy) philosophy build_on owe geological_phenomenon earthquake geophysics energy natural_disaster geology phenomenon oscillation astronomy 2010_Haiti_earthquake geography region area physical_quantity definite_integral quantity person worker industrial_plant factory building business Industrial_architecture
1468226537	geological_phenomenon earthquake geophysics energy natural_disaster geology phenomenon oscillation astronomy 2010_Haiti_earthquake geography Italian_region Abruzzi_e_Molise Geographical_feature elevate hoist plan budget finance sales dead slain be change_magnitude increase dead slain ¿Cuál_es? move follow
204164747929722881	earthquake Harmonic_tremor Historical_region Emilia_(region_of_Italy) change damage main administrative_territorial_entity_of_Italy province_of_Italy Political_division administrative_division comune Modena City
1475247782	geological_phenomenon earthquake geophysics energy natural_disaster geology phenomenon oscillation astronomy 2010_Haiti_earthquake geography Italian_region Abruzzi_e_Molise Geographical_feature juvenile minor person turn perish definite_quantity number Mathematical_object point beginning move follow comprise definite_quantity number Mathematical_object
204058878357405696	military_personnel officer official military_rank Member_of_parliament comune Bondeno geological_phenomenon earthquake geophysics energy natural_disaster geology phenomenon oscillation astronomy 2010_Haiti_earthquake geography
204058739081347074	comune Bondeno people deaf change death biology faith being property process_(computing) event_(philosophy) philosophy action defence point beginning film Earthquake_(film) Film_genre
204062413719482369	geological_phenomenon earthquake geophysics energy natural_disaster geology phenomenon oscillation astronomy 2010_Haiti_earthquake geography region area physical_quantity definite_integral quantity
204058933428625408	person worker work hut Nissen_hut Structure change_integrity break_down geological_phenomenon earthquake geophysics energy natural_disaster geology phenomenon oscillation astronomy 2010_Haiti_earthquake geography
204128357007368192	forbear grandparent kinship parent period night perceive see structure building house technology architecture architectural_structure Structure construction descend dive
462641277721649152	Italian_region Marche attribute space concept entity set set_theory digit decimal_digit symbol dead slain comune Senigallia town
462876119239520256	attribute time scalar term entity dimension measure_(mathematics) mechanical_device pump tool device System soil mud mixture liquid water binary_compound material ingredient chemical_compound chemical_substance create geological_phenomenon flood hydrology rain natural_disaster river water phenomenon Italian_region Marche Attack_(computing) denial-of-service_attack attempt change death biology faith being property process_(computing) event_(philosophy) philosophy comune Senigallia town attention vigilance U.S._state disaster Alerta afresh
1464269232	geological_phenomenon earthquake geophysics energy natural_disaster geology phenomenon oscillation astronomy 2010_Haiti_earthquake geography Italian_region Abruzzi_e_Molise Geographical_feature dead slain damage wound injury Forced_migration internally_displaced_person migration Migració correction spanking Act_of_Parliament song La_plaga fauna plague epidemic_disease infection flora infectious_disease
1461540166	geological_phenomenon earthquake geophysics energy natural_disaster geology phenomenon oscillation astronomy 2010_Haiti_earthquake geography strong period night geographic_point epicenter close about descent collapse change damage desperate bird_genus Aquila taxon eagle Political_division province_of_Spain province administrative_territorial_entity_of_Spain
204072614044504065	change_integrity break_down building house home Structure residential_building
1468454852	representation image Artifact_(error) instance time again change death biology faith being property process_(computing) event_(philosophy) philosophy administrative_division country region Administrative_divisions_of_Germany Federal_republic Federated_state geography unit_of_time second unit SI_base_unit
462638825064648705	way road highway state_highway constructed_structure terminate complete be cause effect appearance impression water dam barrier energy body_of_water civil_engineering Waterkering Hydraulic_structure technology building civil_engineering_construction construction river architectural_structure change_magnitude increase change damage region area physical_quantity definite_integral quantity artificial Italian_region Marche comune Senigallia town
520480092750098432	settlement Alerta Cities_of_Japan Severe_weather_terminology_(United_States) meteorologic always exist be after exist dead correct sympathy pity emotion
463703758757957632	building gazebo Structure region area physical_quantity definite_integral quantity affected support aid be fill Abelian_group module_(mathematics) additive_group change damage
204085581108617217	geological_phenomenon earthquake geophysics energy natural_disaster geology phenomenon oscillation astronomy 2010_Haiti_earthquake geography dead slain
204137640365268992	collapse cave_in completely structure tower architectural_structure Structure comune Finale_Emilia Historical_region Emilia_(region_of_Italy)
1461911993	geological_phenomenon earthquake geophysics energy natural_disaster geology phenomenon oscillation astronomy 2010_Haiti_earthquake geography Italian_region Abruzzi_e_Molise Geographical_feature unfortunate victim big law Property_damage damage Lös_egendom Germany
204100705563320320	geological_phenomenon earthquake geophysics energy natural_disaster geology phenomenon oscillation astronomy 2010_Haiti_earthquake geography administrative_territorial_entity_of_Italy province_of_Italy Political_division administrative_division province_of_Italy Ferrara metropolis Ferrara City comune provincial_capital dead slain
204143612370485248	dead slain damage wound injury geological_phenomenon earthquake geophysics energy natural_disaster geology phenomenon oscillation astronomy 2010_Haiti_earthquake geography
1476102397	geological_phenomenon earthquake geophysics energy natural_disaster geology phenomenon oscillation astronomy 2010_Haiti_earthquake geography still lack
204106192073666560	Municipalities_of_Spain Recuerda municipality unfortunate victim geological_phenomenon earthquake geophysics energy natural_disaster geology phenomenon oscillation astronomy 2010_Haiti_earthquake geography dead activity job labour Expressão_idiomática hypothesis particularly
204111188102098944	prayer requiescat dead slain geological_phenomenon earthquake geophysics energy natural_disaster geology phenomenon oscillation astronomy 2010_Haiti_earthquake geography represent embody sufficient bird_genus Aquila taxon eagle
204048769971523585	change damage desperate geological_phenomenon earthquake geophysics energy natural_disaster geology phenomenon oscillation astronomy 2010_Haiti_earthquake geography net
1490935457	channel Enlace_(canal_de_televisión) Italian_region Abruzzi_e_Molise Geographical_feature geological_phenomenon earthquake geophysics energy natural_disaster geology phenomenon oscillation astronomy 2010_Haiti_earthquake geography dead slain actual newspaper daily
462617177213140993	seasoning salt mineral time dead equality balance measure filling flood be nonaccomplishment error property event_(philosophy)
204102595399262208	representation photograph work_of_art image change damage cause effect geological_phenomenon earthquake geophysics energy natural_disaster geology phenomenon oscillation astronomy 2010_Haiti_earthquake geography cause effect idea belief
1462869055	geological_phenomenon earthquake geophysics energy natural_disaster geology phenomenon oscillation astronomy 2010_Haiti_earthquake geography Italian_region Abruzzi_e_Molise Geographical_feature change death biology faith being property process_(computing) event_(philosophy) philosophy Forced_migration internally_displaced_person migration Migració damage wound injury
462696053821943808	mechanical_device pump tool device System pump water_pump liquid water binary_compound material ingredient chemical_compound chemical_substance name brand symbol Marketing_strategy dead slain comune Senigallia town vice gambling game_of_chance recreation game entertainment commonality solidarity population World_population Earth United_Nations Total_S.A. name number concept
204059347175743488	geological_phenomenon earthquake geophysics energy natural_disaster geology phenomenon oscillation astronomy 2010_Haiti_earthquake geography change_integrity break_down hut Nissen_hut Structure region area physical_quantity definite_integral quantity unfortunate victim
462619161512775680	geological_phenomenon flood hydrology rain natural_disaster river water phenomenon Italian_region Marche people dead state state_of_affairs concept critical comune Senigallia town
204138721447120897	earthquake Harmonic_tremor surface finish predict read unpleasantness horridness change death biology faith being property process_(computing) event_(philosophy) philosophy unit_of_time day International_System_of_Units
204132734434680832	Tremor_(signo) encounter scrap debris Garbage_(band) natural_object body object end_product oeuvre work_of_art activity job labour Expressão_idiomática hypothesis
204074683908366336	exist people dead geological_phenomenon earthquake geophysics energy natural_disaster geology phenomenon oscillation astronomy 2010_Haiti_earthquake geography
1489740531	Village_(United_States) Anna,_Ohio municipality town City settlement village Angelo,_Wisconsin administrative_division country region Administrative_divisions_of_Germany Federal_republic Federated_state geography dead forget geological_phenomenon earthquake geophysics energy natural_disaster geology phenomenon oscillation astronomy 2010_Haiti_earthquake geography Italian_region Abruzzi_e_Molise Geographical_feature
204074165022629888	change damage geological_phenomenon earthquake geophysics energy natural_disaster geology phenomenon oscillation astronomy 2010_Haiti_earthquake geography structure tower architectural_structure Structure country_house chateau manor_house house Official_residence metropolis Ferrara City comune provincial_capital
204097797224546305	geological_phenomenon earthquake geophysics energy natural_disaster geology phenomenon oscillation astronomy 2010_Haiti_earthquake geography Historical_region Emilia_(region_of_Italy) Italian_region Emilia-Romagna Historical_region Romagna dead slain computer_network internet System
520347159682895872	unfortunate victim
204055052053266432	geological_phenomenon earthquake geophysics energy natural_disaster geology phenomenon oscillation astronomy 2010_Haiti_earthquake geography person worker comune Bondeno point beginning
1468626348	strong geological_phenomenon earthquake geophysics energy natural_disaster geology phenomenon oscillation astronomy 2010_Haiti_earthquake geography execute unit_of_time minute unit bird_genus Aquila taxon eagle European_country Italy nation country member_state_of_the_United_Nations member_state_of_the_Council_of_Europe social_state Member_state_of_the_European_Union Parliamentary_republic unitary_state scrap debris Garbage_(band) structure building house technology architecture architectural_structure Structure construction fear panic psychology emotion Sensation_(event) adscititious
204205646567051264	novel educational_institution school building institution school primary_school educational_institution elementary_education institution primary change_integrity break_down comune Finale_Emilia Historical_region Emilia_(region_of_Italy)
204058686811938816	person worker Literary_technique bondage_(BDSM) geological_phenomenon earthquake geophysics energy natural_disaster geology phenomenon oscillation astronomy 2010_Haiti_earthquake geography turn perish
204115305679687680	geological_phenomenon earthquake geophysics energy natural_disaster geology phenomenon oscillation astronomy 2010_Haiti_earthquake geography Historical_region Emilia_(region_of_Italy) Italian_region Emilia-Romagna Historical_region Romagna close about social_group family clan person people
1464625693	geological_phenomenon earthquake geophysics energy natural_disaster geology phenomenon oscillation astronomy 2010_Haiti_earthquake geography bird_genus Aquila taxon eagle large_integer 10 deficient_number composite_number Triangular_number integer unfortunate victim unit_of_time hour unit core_out dig scrap debris Garbage_(band)
1461826567	geological_phenomenon earthquake geophysics energy natural_disaster geology phenomenon oscillation astronomy 2010_Haiti_earthquake geography Italian_region Abruzzi_e_Molise Geographical_feature unfortunate victim digit decimal_digit symbol dead slain geological_phenomenon earthquake geophysics energy natural_disaster geology phenomenon oscillation astronomy 2010_Haiti_earthquake geography touch hit stroke blow
204210692545445888	surface finish perceive see descent collapse building house home Structure residential_building Live_album Vivo_(Ricardo_Arjona_album) geological_phenomenon earthquake geophysics energy natural_disaster geology phenomenon oscillation astronomy 2010_Haiti_earthquake geography
204054000465752064	geological_phenomenon earthquake geophysics energy natural_disaster geology phenomenon oscillation astronomy 2010_Haiti_earthquake geography change damage country_house chateau manor_house house Official_residence
204172384972972032	dead slain asterid_dicot_genus Emilia genus taxon emotion fear geological_phenomenon earthquake geophysics energy natural_disaster geology phenomenon oscillation astronomy 2010_Haiti_earthquake geography move return
521595689856696320	fanny cunt terminology hoi_polloi following be_able_to move weekday Tuesday day_of_the_week
204051597142142976	cost price quantity survival custom practice hope optimism
204220265327116289	geological_phenomenon earthquake geophysics energy natural_disaster geology phenomenon oscillation astronomy 2010_Haiti_earthquake geography change_integrity break_down Serial_(radio_and_television) Los_Ancianos structure building house technology architecture architectural_structure Structure construction depot warehouse architectural_structure storage Commercial_building industrial
