204051269453742080	Burnaby Creo Digital_printing company British_Columbia word hashtag phrase geological_phenomenon earthquake geophysics energy natural_disaster geology phenomenon oscillation astronomy 2010_Haiti_earthquake geography be warn alert common_fraction half number Irreducible_fraction fore-and-aft_sail lateen sail
204051236796907520	think comprise liqueur limoncello Lemon_liqueur geological_phenomenon earthquake geophysics energy natural_disaster geology phenomenon oscillation astronomy 2010_Haiti_earthquake geography
204051219327619072	big honor fame drive hunger sensory_system chemical geological_phenomenon earthquake geophysics energy natural_disaster geology phenomenon oscillation astronomy 2010_Haiti_earthquake geography
204051113060737024	apparently asterid_dicot_genus Emilia genus taxon exist communicate joke
204051035982016514	imprimatur OK word abbreviation acronym interjection slang be_able_to alter get want care doze_off
204051002108817408	be happening one-off exist look feel economic_condition shakeout terminology
204050982701776896	terminate complete geological_phenomenon earthquake geophysics energy natural_disaster geology phenomenon oscillation astronomy 2010_Haiti_earthquake geography alter get doze_off geological_phenomenon earthquake geophysics energy natural_disaster geology phenomenon oscillation astronomy 2010_Haiti_earthquake geography
204050975340769281	geological_phenomenon earthquake geophysics energy natural_disaster geology phenomenon oscillation astronomy 2010_Haiti_earthquake geography comprise second latter jewellery cufflink piece_of_jewellery fastener metropolis Adana district_of_Turkey City
204050922345738240	mental_condition anxiety emotion group people social_group asterid_dicot_genus Emilia genus taxon net act respond favor good_turn geological_phenomenon earthquake geophysics energy natural_disaster geology phenomenon oscillation astronomy 2010_Haiti_earthquake geography
204050902271787008	geological_phenomenon earthquake geophysics energy natural_disaster geology phenomenon oscillation astronomy 2010_Haiti_earthquake geography act wait coexist co-occur break eclipse today utter say geological_phenomenon earthquake geophysics energy natural_disaster geology phenomenon oscillation astronomy 2010_Haiti_earthquake geography
204050888451563520	benignity favor metropolis Padua City city_with_hundreds_of_thousands_of_inhabitants comune College_town geological_phenomenon earthquake geophysics energy natural_disaster geology phenomenon oscillation astronomy 2010_Haiti_earthquake geography
204050864376258560	present now precipitate rain here comune Modena City geological_phenomenon earthquake geophysics energy natural_disaster geology phenomenon oscillation astronomy 2010_Haiti_earthquake geography
204050857183035392	new here
204050844117770240	now even periodic_event beat internal_organ heart organ terminology be look geological_phenomenon earthquake geophysics energy natural_disaster geology phenomenon oscillation astronomy 2010_Haiti_earthquake geography be_able_to
204050833434873856	joint-stock_company Mediaset company Creature_type_(Dungeons_&_Dragons) Outsider_(Dungeons_&_Dragons) service Teletext exist represent actualise geological_phenomenon earthquake geophysics energy natural_disaster geology phenomenon oscillation astronomy 2010_Haiti_earthquake geography
204050787456921601	comune Bondeno be administrative_territorial_entity_of_Italy province_of_Italy Political_division administrative_division province_of_Italy Ferrara look feel geological_phenomenon earthquake geophysics energy natural_disaster geology phenomenon oscillation astronomy 2010_Haiti_earthquake geography
204050620037079040	punctuation full_stop symbol typography punctuation_mark female_sibling sister articulate ask about geological_phenomenon earthquake geophysics energy natural_disaster geology phenomenon oscillation astronomy 2010_Haiti_earthquake geography
204050613963726850	benignity favor search info word geological_phenomenon earthquake geophysics energy natural_disaster geology phenomenon oscillation astronomy 2010_Haiti_earthquake geography
204050597408808960	move stratum bed division be perceive listen geological_phenomenon earthquake geophysics energy natural_disaster geology phenomenon oscillation astronomy 2010_Haiti_earthquake geography
204050568078049280	building house home Structure residential_building geological_phenomenon earthquake geophysics energy natural_disaster geology phenomenon oscillation astronomy 2010_Haiti_earthquake geography
204050536402665472	geological_phenomenon earthquake geophysics energy natural_disaster geology phenomenon oscillation astronomy 2010_Haiti_earthquake geography financial_statement account Structure accounting economics microblogging Twitter Social_networking_service add_up make so futile actor's_line aside Literary_technique info word
204050521978441728	perceive see hour dawn forenoon fictional_planet time period forenoon time comune Modena City geological_phenomenon earthquake geophysics energy natural_disaster geology phenomenon oscillation astronomy 2010_Haiti_earthquake geography
204050514776825856	create work bad fate bad_luck phenomenon luck superstition Tro philosophy concept geological_phenomenon earthquake geophysics energy natural_disaster geology phenomenon oscillation astronomy 2010_Haiti_earthquake geography
204050513157828608	lover darling furniture bed bedroom_furniture quiet want care alter get doze_off
204050423882055680	perceive listen region area physical_quantity definite_integral quantity religious_ceremony confirmation rite geological_phenomenon earthquake geophysics energy natural_disaster geology phenomenon oscillation astronomy 2010_Haiti_earthquake geography
204050405053829120	comprise happening one-off item piece geological_phenomenon earthquake geophysics energy natural_disaster geology phenomenon oscillation astronomy 2010_Haiti_earthquake geography
204050379904782336	nightwear jammies clothing geological_phenomenon earthquake geophysics energy natural_disaster geology phenomenon oscillation astronomy 2010_Haiti_earthquake geography
204050329149509633	physical_condition sleep move furniture bed bedroom_furniture arrive stupefaction stupor period night
204050323680145408	part segment plane_figure line set power_set subset language Toda_language language bunkum bullshit word Expletive_attributive Lord grandee word distance hour
204050295993540608	people damned geological_phenomenon earthquake geophysics energy natural_disaster geology phenomenon oscillation astronomy 2010_Haiti_earthquake geography be_able_to doze_off
204050278293573632	move turn move dance no_longer rest kip
204050260476182529	perceive listen geological_phenomenon earthquake geophysics energy natural_disaster geology phenomenon oscillation astronomy 2010_Haiti_earthquake geography
204050131425824768	strong somaesthesia pain sense perception emotion symptom feeling ache headache neurological_disorder pain external_body_part head Mereology well
204050129664229376	Japan dan_(rank) combat_sport martial_art terminology art Mark Nichtakademischer_Titel discharge shoot geological_phenomenon earthquake geophysics energy natural_disaster geology phenomenon oscillation astronomy 2010_Haiti_earthquake geography unit_of_time day International_System_of_Units
204050124282933248	think Voy move return doze_off geological_phenomenon earthquake geophysics energy natural_disaster geology phenomenon oscillation astronomy 2010_Haiti_earthquake geography
204050122739425280	American_Indian Mayan clan American-Indian_language phylum civilization workplace telephone_exchange System be communicate speak geological_phenomenon earthquake geophysics energy natural_disaster geology phenomenon oscillation astronomy 2010_Haiti_earthquake geography just European_country Italy nation country member_state_of_the_United_Nations member_state_of_the_Council_of_Europe social_state Member_state_of_the_European_Union Parliamentary_republic unitary_state
204050102342524928	proceedings case relationship Legal_transaction civil_action number In_case_of_emergency crisis emergency have keep felid cat mammal pet taxon geological_phenomenon earthquake geophysics energy natural_disaster geology phenomenon oscillation astronomy 2010_Haiti_earthquake geography
204050014564122624	geological_phenomenon earthquake geophysics energy natural_disaster geology phenomenon oscillation astronomy 2010_Haiti_earthquake geography rank first turn awake rest kip geological_phenomenon earthquake geophysics energy natural_disaster geology phenomenon oscillation astronomy 2010_Haiti_earthquake geography
204049928891277313	change updating move follow earthquake Harmonic_tremor
204049909173850112	Description How-to geological_phenomenon earthquake geophysics energy natural_disaster geology phenomenon oscillation astronomy 2010_Haiti_earthquake geography
204049874101084163	name Carlo male_given_name given_name Chess_variant utter say
204049814634237954	musical_notation natural accidental chronology timeline chronicle One_Way_(American_band) application web_browser
204049810343464960	Voy natural_object body object geological_phenomenon earthquake geophysics energy natural_disaster geology phenomenon oscillation astronomy 2010_Haiti_earthquake geography
204049787186724864	mental_condition anxiety emotion time moment be_able_to geological_phenomenon earthquake geophysics energy natural_disaster geology phenomenon oscillation astronomy 2010_Haiti_earthquake geography
204049758191497217	geological_phenomenon earthquake geophysics energy natural_disaster geology phenomenon oscillation astronomy 2010_Haiti_earthquake geography military_quarters barrack defender firefighter profession laborer rescuer medium vehicle slat louver Window_shutter window_blind window open
204049699274104832	owe exist leave scram thoroughfare street architectural_structure state_highway act respond geological_phenomenon earthquake geophysics energy natural_disaster geology phenomenon oscillation astronomy 2010_Haiti_earthquake geography
204049679166619648	pot coffeepot home_appliance Small_appliance appendage handle object brew beer alcoholic_beverage be definite phenomenon luck superstition Tro philosophy concept cocktail Terremoto_(cocktail)
204049678457782273	being person causal_agency subjectivism subject chirp tweet thoroughfare street architectural_structure state_highway
204049669536485377	unfortunate victim bird_genus Aquila taxon eagle perceive see change death biology faith being property process_(computing) event_(philosophy) philosophy surface end geological_phenomenon earthquake geophysics energy natural_disaster geology phenomenon oscillation astronomy 2010_Haiti_earthquake geography
204049660694896640	sound_property silence acoustic_wave language structure tower architectural_structure Structure
204049651563900928	drive hunger sensory_system geological_phenomenon earthquake geophysics energy natural_disaster geology phenomenon oscillation astronomy 2010_Haiti_earthquake geography
204049624166707201	geological_phenomenon earthquake geophysics energy natural_disaster geology phenomenon oscillation astronomy 2010_Haiti_earthquake geography then hold vindicate explain always come_about instrumentality medium tool entity computer_memory channel period night
204049622157639680	geological_phenomenon earthquake geophysics energy natural_disaster geology phenomenon oscillation astronomy 2010_Haiti_earthquake geography domesticated_animal dog Canis canid mammal fauna Canidae gray_wolf Brazil taxon Trinomial_nomenclature rest kip blithely
204049578784333824	actually perceive listen always concern earth
204049578272632833	good geological_phenomenon earthquake geophysics energy natural_disaster geology phenomenon oscillation astronomy 2010_Haiti_earthquake geography
204049550627979264	always period night increase escalation
204049522840707074	setup still laboratory feature associate have_in_mind remember mind noise rumble noise impact bump
204049380112736256	big importance emphasis geological_phenomenon earthquake geophysics energy natural_disaster geology phenomenon oscillation astronomy 2010_Haiti_earthquake geography
204049353571180544	bunkum bullshit word Expletive_attributive little edge_tool pickaxe agricultural_tool hand_tool geological_phenomenon earthquake geophysics energy natural_disaster geology phenomenon oscillation astronomy 2010_Haiti_earthquake geography
204049333866336256	comprise geological_phenomenon earthquake geophysics energy natural_disaster geology phenomenon oscillation astronomy 2010_Haiti_earthquake geography comprise
204049301595369472	catchphrase I'll_be_back after late change updating geological_phenomenon earthquake geophysics energy natural_disaster geology phenomenon oscillation astronomy 2010_Haiti_earthquake geography
204049272293953536	exist perceive listen entity thing geological_phenomenon earthquake geophysics energy natural_disaster geology phenomenon oscillation astronomy 2010_Haiti_earthquake geography connect bridge execute
204049269630582784	Romance Italian language pro-drop_language comprise good geological_phenomenon earthquake geophysics energy natural_disaster geology phenomenon oscillation astronomy 2010_Haiti_earthquake geography
204049190555369472	know comprise happening one-off be_able_to close area center after geological_phenomenon earthquake geophysics energy natural_disaster geology phenomenon oscillation astronomy 2010_Haiti_earthquake geography
204049180510003200	geological_phenomenon earthquake geophysics energy natural_disaster geology phenomenon oscillation astronomy 2010_Haiti_earthquake geography think ponder ponder wonder be_able_to
204049142597689344	higher_cognitive_process thought mental_process European_country Italy nation country member_state_of_the_United_Nations member_state_of_the_Council_of_Europe social_state Member_state_of_the_European_Union Parliamentary_republic unitary_state geological_phenomenon earthquake geophysics energy natural_disaster geology phenomenon oscillation astronomy 2010_Haiti_earthquake geography such_a instance time be communication sign object telephone_exchange play mental_representation
204049115737362432	geological_phenomenon earthquake geophysics energy natural_disaster geology phenomenon oscillation astronomy 2010_Haiti_earthquake geography Hypostasis_(linguistics) Mah deity
204049109286531072	coin Dime_(United_States_coin) Coins_of_the_United_States_dollar almost execute activity continuation comprise just lose geological_phenomenon earthquake geophysics energy natural_disaster geology phenomenon oscillation astronomy 2010_Haiti_earthquake geography
204049048800468992	comment criticize break eclipse then just European_country Italy nation country member_state_of_the_United_Nations member_state_of_the_Council_of_Europe social_state Member_state_of_the_European_Union Parliamentary_republic unitary_state
204049001639718914	forthwith rest kip person best comic_book leave bun croissant pastry viennoiserie bap
204048971923079168	geological_phenomenon earthquake geophysics energy natural_disaster geology phenomenon oscillation astronomy 2010_Haiti_earthquake geography
204048942625849345	time moment mental_condition anxiety emotion hold drive hunger sensory_system condition guilt plea nation geological_phenomenon earthquake geophysics energy natural_disaster geology phenomenon oscillation astronomy 2010_Haiti_earthquake geography
204048939303972864	geological_phenomenon earthquake geophysics energy natural_disaster geology phenomenon oscillation astronomy 2010_Haiti_earthquake geography label call dagger kris cold_weapon
204048932924424192	condition safety nation motor_vehicle automobile geological_phenomenon earthquake geophysics energy natural_disaster geology phenomenon oscillation astronomy 2010_Haiti_earthquake geography
204048907469209602	still be_able_to perceive listen vehicle ambulance automobile mother mammy geological_phenomenon earthquake geophysics energy natural_disaster geology phenomenon oscillation astronomy 2010_Haiti_earthquake geography
204048842537172992	aware tomorrow film Mañana_es_domingo Cinema_of_Argentina comprise day_of_rest Sunday day_of_the_week literary_work terminology bask perceive see comprise weekday Monday day_of_the_week geological_phenomenon earthquake geophysics energy natural_disaster geology phenomenon oscillation astronomy 2010_Haiti_earthquake geography
204048813902667776	sender spammer doping prevent stop geological_phenomenon earthquake geophysics energy natural_disaster geology phenomenon oscillation astronomy 2010_Haiti_earthquake geography
204048792465584128	all_right good important_person worthy motility closing time day excrement feces waste geological_phenomenon earthquake geophysics energy natural_disaster geology phenomenon oscillation astronomy 2010_Haiti_earthquake geography
204048700769705984	geological_phenomenon earthquake geophysics energy natural_disaster geology phenomenon oscillation astronomy 2010_Haiti_earthquake geography microblogging Twitter Social_networking_service word hashtag phrase American_Indian Mayan clan American-Indian_language phylum civilization begin get_going take_off
204048699872116736	compassionate care unify marry
204048683686301696	read reread astrologer Nostradamus human pharmacist geological_phenomenon earthquake geophysics energy natural_disaster geology phenomenon oscillation astronomy 2010_Haiti_earthquake geography
204048645635571712	geological_phenomenon earthquake geophysics energy natural_disaster geology phenomenon oscillation astronomy 2010_Haiti_earthquake geography capsicum cayenne_pepper spice taxon fruit Common_name vine apparently American_Indian Mayan clan American-Indian_language phylum civilization
204048634852020224	speculate suppose concern earth leave go part hell
204048626115280898	speculate suppose displace unit_of_time hour unit after geological_phenomenon earthquake geophysics energy natural_disaster geology phenomenon oscillation astronomy 2010_Haiti_earthquake geography
204048574802178048	geological_phenomenon earthquake geophysics energy natural_disaster geology phenomenon oscillation astronomy 2010_Haiti_earthquake geography 2 couplet group cattle ox Bovidae draft_animal
204048562311532545	move geological_phenomenon earthquake geophysics energy natural_disaster geology phenomenon oscillation astronomy 2010_Haiti_earthquake geography
204048531600850944	perceive listen
204048518405558273	now transfer give work service good geological_phenomenon earthquake geophysics energy natural_disaster geology phenomenon oscillation astronomy 2010_Haiti_earthquake geography
204048503276703745	brother uncle kinsman sister-in-law kinship perceive hear geological_phenomenon earthquake geophysics energy natural_disaster geology phenomenon oscillation astronomy 2010_Haiti_earthquake geography
204048493554319360	create_by_mental_act imagine call roar behavior ethology geological_phenomenon earthquake geophysics energy natural_disaster geology phenomenon oscillation astronomy 2010_Haiti_earthquake geography exist
204048399887122432	period night white geological_phenomenon earthquake geophysics energy natural_disaster geology phenomenon oscillation astronomy 2010_Haiti_earthquake geography execute good
204048387065122816	criterion graduated_table criterion graduated_table activity measurement metrology process_(computing) physical_phenomenon energy entity extensive_physical_property scalar quantity measure geological_phenomenon earthquake geophysics energy natural_disaster geology phenomenon oscillation astronomy 2010_Haiti_earthquake geography chirp tweet
204048380777865216	good rely depend emotion fear geological_phenomenon earthquake geophysics energy natural_disaster geology phenomenon oscillation astronomy 2010_Haiti_earthquake geography
204048370036256770	point then be happening one-off physical_condition wakefulness waking awareness decide offspring child cohort human geological_phenomenon earthquake geophysics energy natural_disaster geology phenomenon oscillation astronomy 2010_Haiti_earthquake geography
204048325807325184	like prefer
204048325564051456	present now arrive geological_phenomenon earthquake geophysics energy natural_disaster geology phenomenon oscillation astronomy 2010_Haiti_earthquake geography
204048323655630848	execute good straight geological_phenomenon earthquake geophysics energy natural_disaster geology phenomenon oscillation astronomy 2010_Haiti_earthquake geography
204048320161787904	instance time exist touch hit month May Gregorian_calendar_month domesticated_animal dog Canis canid mammal fauna Canidae gray_wolf Brazil taxon Trinomial_nomenclature geological_phenomenon earthquake geophysics energy natural_disaster geology phenomenon oscillation astronomy 2010_Haiti_earthquake geography
204048296233271296	info word atmosphere sky astronomy publishing desktop_publishing Creation_myth marketing Special_edition particular geological_phenomenon earthquake geophysics energy natural_disaster geology phenomenon oscillation astronomy 2010_Haiti_earthquake geography time moment
204048288578674690	male_given_name Cristoforo cover_version alone copulate have_sex geological_phenomenon earthquake geophysics energy natural_disaster geology phenomenon oscillation astronomy 2010_Haiti_earthquake geography
204048265006694401	person friend Italian after geological_phenomenon earthquake geophysics energy natural_disaster geology phenomenon oscillation astronomy 2010_Haiti_earthquake geography
204048254726455297	perceive feel geological_phenomenon earthquake geophysics energy natural_disaster geology phenomenon oscillation astronomy 2010_Haiti_earthquake geography last_night social_group family clan person people
204048230458195968	geological_phenomenon earthquake geophysics energy natural_disaster geology phenomenon oscillation astronomy 2010_Haiti_earthquake geography definite broadcasting television Mediu_(arte_și_cultură) data-storage_medium be slow slow slow
204048226280681473	now create work bad fate bad_luck phenomenon luck superstition Tro philosophy concept
204048215765565440	geological_phenomenon earthquake geophysics energy natural_disaster geology phenomenon oscillation astronomy 2010_Haiti_earthquake geography
204048204461907968	pathology infarction geological_phenomenon earthquake geophysics energy natural_disaster geology phenomenon oscillation astronomy 2010_Haiti_earthquake geography
204048140339392512	geological_phenomenon earthquake geophysics energy natural_disaster geology phenomenon oscillation astronomy 2010_Haiti_earthquake geography woman mother parent kinship fear panic psychology emotion Sensation_(event) utterance laughter psychology happiness human reflex behavior emotion demonstration chemical_reaction
204048135960530944	begin
204048110408843264	sexual_intercourse fuck word geological_phenomenon earthquake geophysics energy natural_disaster geology phenomenon oscillation astronomy 2010_Haiti_earthquake geography stroke blow
204048103031062528	comprise name Carlo male_given_name given_name Chess_variant transfer give start startle_response Fight-or-flight_response perceive listen
204048098396344321	sufficient doze_off
204048085079425024	expect opine act wait hour dawn forenoon fictional_planet time geological_phenomenon earthquake geophysics energy natural_disaster geology phenomenon oscillation astronomy 2010_Haiti_earthquake geography
204048083527532544	exist comprise Software_design_pattern State_pattern
204048070906880001	geological_phenomenon earthquake geophysics energy natural_disaster geology phenomenon oscillation astronomy 2010_Haiti_earthquake geography geological_phenomenon earthquake geophysics energy natural_disaster geology phenomenon oscillation astronomy 2010_Haiti_earthquake geography room hall risk Trading_room activity operation assert allege happening beginning group cloud behavior event_(probability_theory) Earthquake_swarm
204048060072988674	info word region area physical_quantity definite_integral quantity close geographic_point epicenter geological_phenomenon earthquake geophysics energy natural_disaster geology phenomenon oscillation astronomy 2010_Haiti_earthquake geography
204048056369426434	geological_phenomenon earthquake geophysics energy natural_disaster geology phenomenon oscillation astronomy 2010_Haiti_earthquake geography entrance enrollment acknowledgment receipt acknowledgement room bar Drinking_establishment Chinese building_complex industrial_plant building storey first_floor low
204048031211982848	scream shriek comprise almost island Dia_(island) coast ask query geological_phenomenon earthquake geophysics energy natural_disaster geology phenomenon oscillation astronomy 2010_Haiti_earthquake geography
204048016989102081	utter say then certain be person slave apartment penthouse sexual_intercourse fuck word geological_phenomenon earthquake geophysics energy natural_disaster geology phenomenon oscillation astronomy 2010_Haiti_earthquake geography
204048005828059136	too perceive listen geological_phenomenon earthquake geophysics energy natural_disaster geology phenomenon oscillation astronomy 2010_Haiti_earthquake geography
204047988442677250	geological_phenomenon earthquake geophysics energy natural_disaster geology phenomenon oscillation astronomy 2010_Haiti_earthquake geography give pay move insane be faculty reason mental_process terminology capacity commune Oô
204047975205437442	emotion love stock_character approval congratulations protection hedge Position_(finance) geological_phenomenon earthquake geophysics energy natural_disaster geology phenomenon oscillation astronomy 2010_Haiti_earthquake geography
204047961213251585	lack alone geological_phenomenon earthquake geophysics energy natural_disaster geology phenomenon oscillation astronomy 2010_Haiti_earthquake geography
