204044949472288768	displace comprise amazement surprise
204044942480375808	comprise label call descend go_down geological_phenomenon earthquake geophysics energy natural_disaster geology phenomenon oscillation astronomy 2010_Haiti_earthquake geography
204044940391620608	geological_phenomenon earthquake geophysics energy natural_disaster geology phenomenon oscillation astronomy 2010_Haiti_earthquake geography acquire accept judge reject
204044935798853632	forceful irregularity fitfulness brio liveliness geological_phenomenon earthquake geophysics energy natural_disaster geology phenomenon oscillation astronomy 2010_Haiti_earthquake geography
204044904459010049	begin think create work bad fate bad_luck phenomenon luck superstition Tro philosophy concept geological_phenomenon earthquake geophysics energy natural_disaster geology phenomenon oscillation astronomy 2010_Haiti_earthquake geography
204044877141516288	posture gracefulness geological_phenomenon earthquake geophysics energy natural_disaster geology phenomenon oscillation astronomy 2010_Haiti_earthquake geography happening one-off transfer give physical_phenomenon force physical_quantity study
204044764155363329	jock leg acquisition gift Culture tradition party sociology money everything behavior hypothesis geological_phenomenon earthquake geophysics energy natural_disaster geology phenomenon oscillation astronomy 2010_Haiti_earthquake geography
204044691681980417	exist domesticated_animal dog Canis canid mammal fauna Canidae gray_wolf Brazil taxon Trinomial_nomenclature be_able_to believe rely
204044640507265024	be salutary album Tidings info word geological_phenomenon earthquake geophysics energy natural_disaster geology phenomenon oscillation astronomy 2010_Haiti_earthquake geography jaunt travel
204044638494003200	speculate suppose period week unit_of_time move good geological_phenomenon earthquake geophysics energy natural_disaster geology phenomenon oscillation astronomy 2010_Haiti_earthquake geography
204044511310135298	punctuation full_stop symbol typography punctuation_mark comprise goal objective get_rid_of discard look peek looking glance vestment alb ecclesiastical_dress clothing geological_phenomenon earthquake geophysics energy natural_disaster geology phenomenon oscillation astronomy 2010_Haiti_earthquake geography
204044499310227456	never_mind worry even accursed geological_phenomenon earthquake geophysics energy natural_disaster geology phenomenon oscillation astronomy 2010_Haiti_earthquake geography
204044494058950660	journalism journalist author profession in_the_know microblogging Twitter Social_networking_service
204044490841931776	perceive see representation photograph work_of_art image geological_phenomenon earthquake geophysics energy natural_disaster geology phenomenon oscillation astronomy 2010_Haiti_earthquake geography Mobile_app Instagram Social_networking_service Social_network program calculate deduct comprise framework frame absolute
204044475390103554	geological_phenomenon earthquake geophysics energy natural_disaster geology phenomenon oscillation astronomy 2010_Haiti_earthquake geography cognitive_content goal destiny day_of_reckoning concern earth
204044451943952385	geological_phenomenon earthquake geophysics energy natural_disaster geology phenomenon oscillation astronomy 2010_Haiti_earthquake geography rest kip
204044444125773826	protection insurance principle risk_management function better
204044424139907072	alliaceous_plant garlic first_description_(of_a_taxon) vegetable taxon species flora lipid oil material chemical_substance vegetable_oil olive_oil cooking_oil chemical_compound fat olive_tree olive first_description_(of_a_taxon) taxon tree capsicum paprika seasoning Capsicum_annuum spice cayenne_pepper vegetable Capsicum_annuum cayenne_pepper genus first_description_(of_a_taxon) taxon spice pungency food spice measurement perception system classical_conditioning geological_phenomenon earthquake geophysics energy natural_disaster geology phenomenon oscillation astronomy 2010_Haiti_earthquake geography
204044380812750848	geological_phenomenon earthquake geophysics energy natural_disaster geology phenomenon oscillation astronomy 2010_Haiti_earthquake geography channel Quiero_música_en_mi_idioma person photographer artist profession
204044363813228545	geological_phenomenon earthquake geophysics energy natural_disaster geology phenomenon oscillation astronomy 2010_Haiti_earthquake geography now move doze_off a_bit_much emotion reverence comprise truthfulness sooth concept
204044315759099904	sector business_sector economic_system sight detect knowledge information concept identifier sequence dependable geological_phenomenon earthquake geophysics energy natural_disaster geology phenomenon oscillation astronomy 2010_Haiti_earthquake geography
204044301049675776	domesticated_animal dog Canis canid mammal fauna Canidae gray_wolf Brazil taxon Trinomial_nomenclature rest kip good communication sign object telephone_exchange play mental_representation geological_phenomenon earthquake geophysics energy natural_disaster geology phenomenon oscillation astronomy 2010_Haiti_earthquake geography
204044274877206528	be remain geological_phenomenon earthquake geophysics energy natural_disaster geology phenomenon oscillation astronomy 2010_Haiti_earthquake geography
204044227846488064	articulate ask come_about mechanical_device pump tool device System situation crisis event_(philosophy) geological_phenomenon earthquake geophysics energy natural_disaster geology phenomenon oscillation astronomy 2010_Haiti_earthquake geography
204044218325413890	perceive listen angle inclination rotation communication message object SMS Short_Message_Service matter text sequence medium symbol utterance now rest kip
204044215913684995	geological_phenomenon earthquake geophysics energy natural_disaster geology phenomenon oscillation astronomy 2010_Haiti_earthquake geography football association_football athletics
204044174486548483	geological_phenomenon earthquake geophysics energy natural_disaster geology phenomenon oscillation astronomy 2010_Haiti_earthquake geography exist furthermore effective weekday Friday day_of_the_week day
204044152697131008	move workplace studio room employee artist period forenoon time even geological_phenomenon earthquake geophysics energy natural_disaster geology phenomenon oscillation astronomy 2010_Haiti_earthquake geography
204044149161332740	geological_phenomenon earthquake geophysics energy natural_disaster geology phenomenon oscillation astronomy 2010_Haiti_earthquake geography mechanical_device pump tool device System pass
204044131318759426	religious_song chant singing
204044118693916672	rest kip
204044101530812416	volcano Cerro_Solo mountain stratovolcano pattern Skewbald stratum bed division geological_phenomenon earthquake geophysics energy natural_disaster geology phenomenon oscillation astronomy 2010_Haiti_earthquake geography
204044065438834688	building house home Structure residential_building thoroughfare street architectural_structure state_highway geological_phenomenon earthquake geophysics energy natural_disaster geology phenomenon oscillation astronomy 2010_Haiti_earthquake geography
204044043875909632	language Latin Italic pro-drop_language language geological_phenomenon earthquake geophysics energy natural_disaster geology phenomenon oscillation astronomy 2010_Haiti_earthquake geography
204044028025647105	geological_phenomenon earthquake geophysics energy natural_disaster geology phenomenon oscillation astronomy 2010_Haiti_earthquake geography create unit_of_time day International_System_of_Units noise rumble noise look feel disapprove deter
204044020366843905	forget modify update previously terminate complete geological_phenomenon earthquake geophysics energy natural_disaster geology phenomenon oscillation astronomy 2010_Haiti_earthquake geography
204044001710587904	metropolis Bologna comune College_town City environment milieu encounter good after geological_phenomenon earthquake geophysics energy natural_disaster geology phenomenon oscillation astronomy 2010_Haiti_earthquake geography
204043960186974209	metro_station Pajaritos_metro_station consent allow doze_off geological_phenomenon earthquake geophysics energy natural_disaster geology phenomenon oscillation astronomy 2010_Haiti_earthquake geography
204043934396194817	genre drama Literary_genre manner utter say know geological_phenomenon earthquake geophysics energy natural_disaster geology phenomenon oscillation astronomy 2010_Haiti_earthquake geography
204043904608256000	magazine Awake! free_daily_newspaper unit_of_time hour unit geological_phenomenon earthquake geophysics energy natural_disaster geology phenomenon oscillation astronomy 2010_Haiti_earthquake geography rest kip
204043893799518208	geological_phenomenon earthquake geophysics energy natural_disaster geology phenomenon oscillation astronomy 2010_Haiti_earthquake geography exist haunted
204043811821846528	geological_phenomenon earthquake geophysics energy natural_disaster geology phenomenon oscillation astronomy 2010_Haiti_earthquake geography know detail regard
204043808541904896	composition solo section woman girlfriend lover significant_other be_able_to doze_off unit_of_time minute unit after
204043789835309059	hence learn have keep cell galvanic_cell battery device depot magazine name geological_phenomenon earthquake geophysics energy natural_disaster geology phenomenon oscillation astronomy 2010_Haiti_earthquake geography
204038855106641920	lowerclassman junior terminology geological_phenomenon earthquake geophysics energy natural_disaster geology phenomenon oscillation astronomy 2010_Haiti_earthquake geography change death biology faith being property process_(computing) event_(philosophy) philosophy
204035534992056320	comedian Chico human movie_star
204034627189489664	knowledge information concept identifier sequence broadcasting television Mediu_(arte_și_cultură) data-storage_medium
204032986734264320	perceive feel immortal geological_phenomenon earthquake geophysics energy natural_disaster geology phenomenon oscillation astronomy 2010_Haiti_earthquake geography consent allow pass cognitive_content belief concept mental_process ellipse nation
204030629149556737	have_to person achiever model here accept believe exist military_operation attack infarction myocardial_infarction disease Medical_emergency internal_organ heart organ terminology
1496525961	terminology Multitude open happening fire building tavern Drinking_establishment people dead
1496457204	juvenile minor person turn perish misadventure accident event_(philosophy) collision smash accident juvenile minor person juvenile minor person female female_child
1495028175	republic Mexico North_American_country nation country traveler tourist publication Italian turn perish misadventure accident event_(philosophy) collision smash accident aggregation traffic road physical_phenomenon force physical_quantity police Fuerza_de_seguridad condition safety nation Mexican be execute public
1494565116	country India Asian_country nation Fact_sheet happening fire low_explosive firework explosive_device episode Fire_(The_X-Files) murder massacre killing Violent_crime industrial_plant factory building business Industrial_architecture happening fire low_explosive firework explosive_device affected
1493297170	dried_fruit raisin grape perceive hurt geological_phenomenon earthquake geophysics energy natural_disaster geology phenomenon oscillation astronomy 2010_Haiti_earthquake geography meet actual accept believe people dead
1492445198	change damage cause effect ending closedown sequence prolonged aggregation traffic road act communication behavior announcement press_release communication print_media press
1491244592	apply rock sand soil Granular_material psammite mineral matter material body_of_water sea ocean System investment speculation activity geological_phenomenon earthquake geophysics energy natural_disaster geology phenomenon oscillation astronomy 2010_Haiti_earthquake geography be beat deck building house home Structure residential_building period century unit_of_time year
1489135629	national_capital Athens City city_with_millions_of_inhabitants settlement capital provincial_capital World's_largest_cities shot gunshot establishment university Hochschule place location institution damage wound injury assimilator student enrollee person period year unit_of_time time_standard open happening fire explanation reason consideration unknown
1488805599	people wounded point beginning pitch bass bass misadventure accident event_(philosophy) nautical body_of_water lake water stream lake Lake_Iseo comune Iseo,_Lombardy town
1486382248	geological_phenomenon earthquake geophysics energy natural_disaster geology phenomenon oscillation astronomy 2010_Haiti_earthquake geography Italian_region Abruzzi_e_Molise Geographical_feature Village_(United_States) Anna,_Ohio given_name Aquila_(name) last_name name communicate speak medical_man physician human professional profession dead slain
1485698495	geological_phenomenon earthquake geophysics energy natural_disaster geology phenomenon oscillation astronomy 2010_Haiti_earthquake geography Italian_region Abruzzi_e_Molise Geographical_feature Village_(United_States) Anna,_Ohio given_name Aquila_(name) last_name name communicate speak medical_man physician human professional profession dead slain
1484837302	info word dead slain spring rebound always computer_network World_Wide_Web service_on_internet information_system profession blogger author geological_phenomenon earthquake geophysics energy natural_disaster geology phenomenon oscillation astronomy 2010_Haiti_earthquake geography communicate speak
1484679520	musical_notation accidental note grapheme body_of_water lake water stream lake Lake_Iseo comune Iseo,_Lombardy town wounded low
1483641594	symptom hurting psychological physical emotion anger emotion fear strain stress accent illness disease marketing vendition emotional emotional
1483612882	day yesterday awful misadventure accident event_(philosophy) deathlike infringement foul aggregation traffic road adult man male gender human person sex male age Stage_(stratigraphy) switch Dead_man's_switch dead wounded desperate motor_vehicle automobile
1478557090	island Picton,_Lennox_and_Nueva printing publication Asian_country Japan nation country island_nation geological_phenomenon earthquake geophysics energy natural_disaster geology phenomenon oscillation astronomy 2010_Haiti_earthquake geography transfer give emotion fear people dead
1478480778	educational_institution school building institution function woman mother parent kinship comprise condition safety nation execute bill_of_exchange cheque document
1477229362	island Picton,_Lennox_and_Nueva printing publication Asian_country Japan nation country island_nation geological_phenomenon earthquake geophysics energy natural_disaster geology phenomenon oscillation astronomy 2010_Haiti_earthquake geography transfer give emotion fear dead slain
1477022222	crack crevasse City Caliente,_Nevada administrative_body authority organization room area
1476271898	change damage worse geological_phenomenon earthquake geophysics energy natural_disaster geology phenomenon oscillation astronomy 2010_Haiti_earthquake geography
1476147766	speak go_on utter say Asian_country Japan nation country island_nation exist exist change death biology faith being property process_(computing) event_(philosophy) philosophy be
1475792357	geological_phenomenon earthquake geophysics energy natural_disaster geology phenomenon oscillation astronomy 2010_Haiti_earthquake geography migrant immigrant Inmigrantes_ilegales illegal difficulty problem entity obstacle Challenge_(TV_channel) currently know never comprise
1475338420	geological_phenomenon earthquake geophysics energy natural_disaster geology phenomenon oscillation astronomy 2010_Haiti_earthquake geography arise swell establishment university Hochschule place location institution transfer give explanation reason consideration present now choice ballot group_event imprimatur OK word abbreviation acronym interjection slang make print execute time spell
1472671212	disaster visitation diary blog website periodical opt geological_phenomenon earthquake geophysics energy natural_disaster geology phenomenon oscillation astronomy 2010_Haiti_earthquake geography attitude disposition entity habit combined change death biology faith being property process_(computing) event_(philosophy) philosophy human Bruno_Vespa journalist television arthropod_genus genus_Vespa insist sagely
1472488990	nonfiction article piece state nonbeing comprise geological_phenomenon earthquake geophysics energy natural_disaster geology phenomenon oscillation astronomy 2010_Haiti_earthquake geography kill building house home Structure residential_building destroy demolish scientist investigator
1471737142	geological_phenomenon earthquake geophysics energy natural_disaster geology phenomenon oscillation astronomy 2010_Haiti_earthquake geography structure building house technology architecture architectural_structure Structure construction hardy geological_phenomenon earthquake geophysics energy natural_disaster geology phenomenon oscillation astronomy 2010_Haiti_earthquake geography descent collapse geological_phenomenon earthquake geophysics energy natural_disaster geology phenomenon oscillation astronomy 2010_Haiti_earthquake geography structure building house technology architecture architectural_structure Structure construction hardy geological_phenomenon earthquake geophysics energy natural_disaster geology phenomenon oscillation astronomy 2010_Haiti_earthquake geography descent collapse new health_facility hospital institution health_facility
1471726050	venture cause change death biology faith being property process_(computing) event_(philosophy) philosophy tax inheritance_tax transfer_tax payment owe geological_phenomenon earthquake geophysics energy natural_disaster geology phenomenon oscillation astronomy 2010_Haiti_earthquake geography exist incidence_(epidemiology) meaningful military_operation attack infarction myocardial_infarction disease Medical_emergency internal_organ heart organ terminology owe emotion fear emotion fear strong
1468822355	exist structure pattern pattern Structure gradation component idea form administrative_body authority organization room area construe read exist disease shock_(circulatory) residence palace building ancient deform bend destroy demolish
1468607307	geological_phenomenon earthquake geophysics energy natural_disaster geology phenomenon oscillation astronomy 2010_Haiti_earthquake geography 7th comune Grado,_Friuli-Venezia_Giulia land island landform location place Geographical_feature composition island Kuril_Islands archipelago island Kuril_Islands archipelago change damage
1468558068	European_country Germany republic nation federation country member_state_of_the_Council_of_Europe Member_state_of_the_European_Union Rechtsstaat member_state_of_the_United_Nations social_state shot gunshot assembly tribunal authority institution least dead slain damage wound injury disagreement conflict society philosophy sociology psychology event_(philosophy) Interpersonal_communication choice Proces concept happening fire room classroom design project airline LAN_Airlines brand
1466908929	geological_phenomenon earthquake geophysics energy natural_disaster geology phenomenon oscillation astronomy 2010_Haiti_earthquake geography law common_law Legal_transaction principle about natural_object body comprise cause effect geological_phenomenon earthquake geophysics energy natural_disaster geology phenomenon oscillation astronomy 2010_Haiti_earthquake geography touch hit region area physical_quantity definite_integral quantity
1466584759	misadventure accident event_(philosophy) collision smash accident turn perish period year unit_of_time time_standard low period year unit_of_time time_standard property age female female_child period year unit_of_time time_standard turn perish
1465904683	force police law_enforcement_agency civil_service organization open happening fire advocate separatist damage wound injury force police law_enforcement_agency civil_service organization open happening fire
1465056298	diary blog website periodical exist disappear clear never negative_stimulus sorrow such_a instance time descent collapse aggregation traffic road
1464899497	applied_mathematics statistics mathematics formal_science marketing vendition modify update posture gracefulness spiritual_being God deity god_(male_deity) move follow alter ameliorate
1464835032	second latter geological_phenomenon earthquake geophysics energy natural_disaster geology phenomenon oscillation astronomy 2010_Haiti_earthquake geography conclude feel change death biology faith being property process_(computing) event_(philosophy) philosophy currently exist leave linger
1464793867	fiction Horror_fiction genre album Big_(TV_series) television_program dictator Big_Brother character film Brother_(2000_film) movie_star geological_phenomenon earthquake geophysics energy natural_disaster geology phenomenon oscillation astronomy 2010_Haiti_earthquake geography broadcast episode expel suspend recording video analog_signal electronic_media technology
1464651239	surface finish make print representation image Artifact_(error) happening fire Romance Spanish language language pro-drop_language happening destiny God human faith concept philosophy mythology orach terminology golf_course
1464579218	concern affair geological_phenomenon earthquake geophysics energy natural_disaster geology phenomenon oscillation astronomy 2010_Haiti_earthquake geography European_country Italy nation country member_state_of_the_United_Nations member_state_of_the_Council_of_Europe social_state Member_state_of_the_European_Union Parliamentary_republic unitary_state
1464547923	sound voice knowledge discipline science knowledge_base special_field after geological_phenomenon earthquake geophysics energy natural_disaster geology phenomenon oscillation astronomy 2010_Haiti_earthquake geography comprise force company army_unit military_unit exist say call
1464416011	ask query European_country Italy nation country member_state_of_the_United_Nations member_state_of_the_Council_of_Europe social_state Member_state_of_the_European_Union Parliamentary_republic unitary_state 6th geological_phenomenon earthquake geophysics energy natural_disaster geology phenomenon oscillation astronomy 2010_Haiti_earthquake geography proceedings case relationship Legal_transaction civil_action drama tragedy geological_phenomenon earthquake geophysics energy natural_disaster geology phenomenon oscillation astronomy 2010_Haiti_earthquake geography similar comprise childlike
1464398617	interrogation interview conversation method technique praise promote geological_phenomenon earthquake geophysics energy natural_disaster geology phenomenon oscillation astronomy 2010_Haiti_earthquake geography choice ballot group_event execute time spell
1464039132	administrative_body authority organization room area move building house home Structure residential_building broach address logic reasoning knowledge terminology Processus_cognitifs 2 couplet group attribute thing aggregation traffic road predictable way road highway state_highway constructed_structure highway bypass street road Road_traffic_safety highway bypass street road Road_traffic_safety
1463777123	mouth read succession chess_opening PlayStation_Move geological_phenomenon earthquake geophysics energy natural_disaster geology phenomenon oscillation astronomy 2010_Haiti_earthquake geography control steer forthwith previously displace place point midpoint Point_(geometry) midpoint center_of_gravity attraction gravitation interaction Natural_phenomenon lasting
1463770666	existence life Live_album Vivo_(Ricardo_Arjona_album) humanities history bibliography abstract_object organization presentation person minister clergyman profession authority priest act wait ownership property_right object entity divide disperse geological_phenomenon earthquake geophysics energy natural_disaster geology phenomenon oscillation astronomy 2010_Haiti_earthquake geography
1463764556	somaesthesia pain sense perception emotion symptom feeling ache headache neurological_disorder pain external_body_part head Mereology symptom nausea stomach disease medicine feeling emotion sense Objawy illness alter get alter optical_device lens device Bauteil_(Technik) lens contact_lens Corrective_lens finish interaction contact
1463757844	geological_phenomenon earthquake geophysics energy natural_disaster geology phenomenon oscillation astronomy 2010_Haiti_earthquake geography open opening hole internal_organ stomach organ System leave depart period night always hold drive hunger sensory_system
1463756375	website Facebook Social_networking_service corporation abstraction group unfortunate victim geological_phenomenon earthquake geophysics energy natural_disaster geology phenomenon oscillation astronomy 2010_Haiti_earthquake geography even website Facebook Social_networking_service corporation scheme network social_structure Social_network social known computer_network internet System militarise mobilise
1463737595	Vanyar Aman dialect Wu Chinese language dynasty Ming_dynasty Chinese_dynasty human Fire_(wrestler) grappler humanities history bibliography abstract_object organization presentation happening fire Artifact_(software_development) Secret_Fire secret
1463711920	ago periodical Revista_Semana_(España) interrogation interview conversation hazard predict geological_phenomenon earthquake geophysics energy natural_disaster geology phenomenon oscillation astronomy 2010_Haiti_earthquake geography
