204046426148319232	geological_phenomenon earthquake geophysics energy natural_disaster geology phenomenon oscillation astronomy 2010_Haiti_earthquake geography tremor aftershock earthquake mental_condition anxiety emotion no_longer rest kip
204049637601050625	stroke blow strong change damage
204044989771157506	setup still laboratory geological_phenomenon earthquake geophysics energy natural_disaster geology phenomenon oscillation astronomy 2010_Haiti_earthquake geography metal molybdenum Group_6_element transition_metal Period_5_element chemical_element break break comune Polla town
1461617048	woman mother parent kinship be period night geological_phenomenon earthquake geophysics energy natural_disaster geology phenomenon oscillation astronomy 2010_Haiti_earthquake geography insane
204044937673715712	channel Quiero_música_en_mi_idioma geological_phenomenon earthquake geophysics energy natural_disaster geology phenomenon oscillation astronomy 2010_Haiti_earthquake geography
204044879012167680	setup still laboratory stimulate agitate
204045312485101568	contact impact event_(philosophy) force shock geological_phenomenon earthquake geophysics energy natural_disaster geology phenomenon oscillation astronomy 2010_Haiti_earthquake geography boat barge ship_type ship prizefighter lightweight jock anterior
204045599446798336	ethnic_group Va_people sexual_intercourse fuck word geological_phenomenon earthquake geophysics energy natural_disaster geology phenomenon oscillation astronomy 2010_Haiti_earthquake geography copulate have_sex
204048659237711874	hang lighting_fixture chandelier lamp table_lamp hang hypnotic geological_phenomenon earthquake geophysics energy natural_disaster geology phenomenon oscillation astronomy 2010_Haiti_earthquake geography
1462538183	geological_phenomenon earthquake geophysics energy natural_disaster geology phenomenon oscillation astronomy 2010_Haiti_earthquake geography search body_fluid blood team Negative_(policy_debate) communicate contact settlement City settlement
204177009549647872	strong apparently long even change damage truthfulness sooth concept
204044054881763328	comune Pavia town geological_phenomenon earthquake geophysics energy natural_disaster geology phenomenon oscillation astronomy 2010_Haiti_earthquake geography
1460409270	geological_phenomenon earthquake geophysics energy natural_disaster geology phenomenon oscillation astronomy 2010_Haiti_earthquake geography structure storey building force pull furniture bed bedroom_furniture complain bemoan so strong
204045075725029377	instance time rest kip period night
1464397409	geological_phenomenon earthquake geophysics energy natural_disaster geology phenomenon oscillation astronomy 2010_Haiti_earthquake geography Italian_region Abruzzi_e_Molise Geographical_feature transfer mail assistance succor war aid economics aid_agency Działania law move execute choice ballot group_event imprimatur OK word abbreviation acronym interjection slang make print execute time spell
1461887477	being person causal_agency subjectivism subject scheme network collect raise scene backcloth geological_phenomenon earthquake geophysics energy natural_disaster geology phenomenon oscillation astronomy 2010_Haiti_earthquake geography
204044868127956992	setup still laboratory period night geological_phenomenon earthquake geophysics energy natural_disaster geology phenomenon oscillation astronomy 2010_Haiti_earthquake geography hold awake
204050995813171200	act wait affix post least knowledge information concept identifier sequence motion quiver geological_phenomenon earthquake geophysics energy natural_disaster geology phenomenon oscillation astronomy 2010_Haiti_earthquake geography
204045081496395776	rest kip geological_phenomenon earthquake geophysics energy natural_disaster geology phenomenon oscillation astronomy 2010_Haiti_earthquake geography
204044694936752129	disease shock_(circulatory) region area physical_quantity definite_integral quantity comune Budrio town pole_weapon Bō weapon
1461531389	present now audition read change updating geological_phenomenon earthquake geophysics energy natural_disaster geology phenomenon oscillation astronomy 2010_Haiti_earthquake geography Italian_region Abruzzi_e_Molise Geographical_feature symptom Chills move come thing part subsequent
204045530777653248	comune Modena City geological_phenomenon earthquake geophysics energy natural_disaster geology phenomenon oscillation astronomy 2010_Haiti_earthquake geography
1469175858	cost price quantity geological_phenomenon earthquake geophysics energy natural_disaster geology phenomenon oscillation astronomy 2010_Haiti_earthquake geography be decrease bring_down wit joke humour literature Literary_genre Something_(Beatles_song) Sèrie_curta history idea plan process_(computing) diagram building house home Structure residential_building still liveliness alacrity
204045562021019649	location here Comics speak go_on move dance geological_phenomenon earthquake geophysics energy natural_disaster geology phenomenon oscillation astronomy 2010_Haiti_earthquake geography
204044730978402304	begin new
1463886786	info news broadcasting communication European_country Italy nation country member_state_of_the_United_Nations member_state_of_the_Council_of_Europe social_state Member_state_of_the_European_Union Parliamentary_republic unitary_state geological_phenomenon earthquake geophysics energy natural_disaster geology phenomenon oscillation astronomy 2010_Haiti_earthquake geography Italian_region Abruzzi_e_Molise Geographical_feature concern earth commonality solidarity male_given_name Giorgio_(name) name human Giorgio_Napolitano politician Italian Neapolitan
521640893649256449	judicial_branch Judicial_system_of_China court executive probe inquire misfortune disaster event_(philosophy) risk guilty
204123291856814081	greeting good_morning farewell unit_of_time day International_System_of_Units geological_phenomenon earthquake geophysics energy natural_disaster geology phenomenon oscillation astronomy 2010_Haiti_earthquake geography exist change damage
204226678350819329	pass Italian Old_Italian language language pro-drop_language Romance utter say geological_phenomenon earthquake geophysics energy natural_disaster geology phenomenon oscillation astronomy 2010_Haiti_earthquake geography cause effect change damage truthfulness sooth concept
204045798810456065	setup still laboratory
204037638653612032	sensory_receptor eye organ architectural_element Feature_(archaeology) alter terminate worry fear upper_surface ceiling Bauteil_(Technik) geological_phenomenon earthquake geophysics energy natural_disaster geology phenomenon oscillation astronomy 2010_Haiti_earthquake geography destroy demolish external_body_part head Mereology
204045814325186561	support change damage end termination geological_phenomenon earthquake geophysics energy natural_disaster geology phenomenon oscillation astronomy 2010_Haiti_earthquake geography
204046828105248769	geological_phenomenon earthquake geophysics energy natural_disaster geology phenomenon oscillation astronomy 2010_Haiti_earthquake geography point place entity thing part inform advise change damage dangerous
1460287468	geological_phenomenon earthquake geophysics energy natural_disaster geology phenomenon oscillation astronomy 2010_Haiti_earthquake geography national_capital Rome City capital provincial_capital comune A.M.
204045180054159360	benignity favor coin Dime_(United_States_coin) Coins_of_the_United_States_dollar geographic_point epicenter quality power concept geological_phenomenon earthquake geophysics energy natural_disaster geology phenomenon oscillation astronomy 2010_Haiti_earthquake geography
521217405683785728	have_to instrumentality medium tool entity computer_memory channel hold quality power concept
520527146469830656	rank first precipitate rain now instance time flood inundate
522263877921566722	mouth read perceive see
204046298691805185	geological_phenomenon earthquake geophysics energy natural_disaster geology phenomenon oscillation astronomy 2010_Haiti_earthquake geography big instance time
1461901194	be want work assist announcement notice activity protection war Civil_Protection special_field Intergovernmental_organization concept citizen civilian person geological_phenomenon earthquake geophysics energy natural_disaster geology phenomenon oscillation astronomy 2010_Haiti_earthquake geography
204044918715461633	so geological_phenomenon earthquake geophysics energy natural_disaster geology phenomenon oscillation astronomy 2010_Haiti_earthquake geography
204045839725899777	setup still laboratory change_posture sit close about geological_phenomenon earthquake geophysics energy natural_disaster geology phenomenon oscillation astronomy 2010_Haiti_earthquake geography
204045616463093761	geological_phenomenon earthquake geophysics energy natural_disaster geology phenomenon oscillation astronomy 2010_Haiti_earthquake geography now be_able_to perceive feel
520896013331357696	utter political_party Solidarity_(Polish_trade_union) trade_union federation bishop cardinal minister title profession ministry clergyman episcopate prince comune Bagnasco
204045062626213888	little informing warning agitated recently geological_phenomenon earthquake geophysics energy natural_disaster geology phenomenon oscillation astronomy 2010_Haiti_earthquake geography
204044987804028929	now geological_phenomenon earthquake geophysics energy natural_disaster geology phenomenon oscillation astronomy 2010_Haiti_earthquake geography
204045250006761476	little amazement surprise geological_phenomenon earthquake geophysics energy natural_disaster geology phenomenon oscillation astronomy 2010_Haiti_earthquake geography
204048809934860291	municipality Mantua comune capital City comprise seasoning salt mineral transfer download thoroughfare street architectural_structure state_highway housing apartment home unit geological_phenomenon earthquake geophysics energy natural_disaster geology phenomenon oscillation astronomy 2010_Haiti_earthquake geography
1458685916	geological_phenomenon earthquake geophysics energy natural_disaster geology phenomenon oscillation astronomy 2010_Haiti_earthquake geography informing warning
204044449393803264	earthquake shock acceleration measure endure unit_of_time second unit SI_base_unit think be unit_of_time minute unit
204044859613528064	geological_phenomenon earthquake geophysics energy natural_disaster geology phenomenon oscillation astronomy 2010_Haiti_earthquake geography blow_out
204047561647063040	geological_phenomenon earthquake geophysics energy natural_disaster geology phenomenon oscillation astronomy 2010_Haiti_earthquake geography move follow tremble shiver
520869192715997184	composition solo section exist person maven expert terminology leader tribal_chief ruler Supreme_leader activity protection protection civil_defense special_field elbow_grease civilian statement prediction process_(computing) incorrect
1464397822	geological_phenomenon earthquake geophysics energy natural_disaster geology phenomenon oscillation astronomy 2010_Haiti_earthquake geography group aggregation object-oriented_programming Structure computer_science covering clothing consumer_goods matter material materialism learned_profession medicine medical_practice technology nutrition meal eating nonfiction article piece condition need psychology motivation feeling want concept hypothesis philosophy desire marketing Something_(Beatles_song) weekday Tuesday day_of_the_week month April Gregorian_calendar_month
204044892446523392	amazement surprise act time spell geological_phenomenon earthquake geophysics energy natural_disaster geology phenomenon oscillation astronomy 2010_Haiti_earthquake geography
204045693017534464	relative_quantity enough
204044854622306306	so bunkum bullshit word Expletive_attributive comprise geological_phenomenon earthquake geophysics energy natural_disaster geology phenomenon oscillation astronomy 2010_Haiti_earthquake geography song Déjame album Déjame_dormir doze_off geological_phenomenon earthquake geophysics energy natural_disaster geology phenomenon oscillation astronomy 2010_Haiti_earthquake geography
204044897706196993	contact impact event_(philosophy) force shock geological_phenomenon earthquake geophysics energy natural_disaster geology phenomenon oscillation astronomy 2010_Haiti_earthquake geography fairly hard
204044791833559040	geological_phenomenon earthquake geophysics energy natural_disaster geology phenomenon oscillation astronomy 2010_Haiti_earthquake geography metropolis Bologna comune College_town City alone perceive feel new
204035433334710272	execute change damage geological_phenomenon earthquake geophysics energy natural_disaster geology phenomenon oscillation astronomy 2010_Haiti_earthquake geography
204181569613725696	geological_phenomenon earthquake geophysics energy natural_disaster geology phenomenon oscillation astronomy 2010_Haiti_earthquake geography warn caution indispose hurt
204044725974605824	geological_phenomenon earthquake geophysics energy natural_disaster geology phenomenon oscillation astronomy 2010_Haiti_earthquake geography
204045990313992192	setup still laboratory geological_phenomenon earthquake geophysics energy natural_disaster geology phenomenon oscillation astronomy 2010_Haiti_earthquake geography curt
1464551781	communicate speak how info word geological_phenomenon earthquake geophysics energy natural_disaster geology phenomenon oscillation astronomy 2010_Haiti_earthquake geography terminate complete microblogging Twitter Social_networking_service
204044987690795008	speak go_on community settlement human_geographic_territorial_entity terminology
1461980376	change updating geological_phenomenon earthquake geophysics energy natural_disaster geology phenomenon oscillation astronomy 2010_Haiti_earthquake geography Italian_region Abruzzi_e_Molise Geographical_feature
1461348177	comprise month December Gregorian_calendar_month Ou_Nederlandse_maandname pass exist least period week unit_of_time region area physical_quantity definite_integral quantity unfortunately unfortunately
204044842328801280	prevent stop currently trade_barrier embargo exist geological_phenomenon earthquake geophysics energy natural_disaster geology phenomenon oscillation astronomy 2010_Haiti_earthquake geography
204045026228043776	little comune Budrio town
1460314250	location here Comics geological_phenomenon earthquake geophysics energy natural_disaster geology phenomenon oscillation astronomy 2010_Haiti_earthquake geography region area physical_quantity definite_integral quantity knowledge discipline science knowledge_base special_field
1462260336	greeting hello good truthfulness sooth concept so hence perceive feel geological_phenomenon earthquake geophysics energy natural_disaster geology phenomenon oscillation astronomy 2010_Haiti_earthquake geography phenomenon fortune
204045305799376897	geological_phenomenon earthquake geophysics energy natural_disaster geology phenomenon oscillation astronomy 2010_Haiti_earthquake geography just preserve resume state status law doze_off
204045651871404034	so metropolis Bologna comune College_town City execute time spell geological_phenomenon earthquake geophysics energy natural_disaster geology phenomenon oscillation astronomy 2010_Haiti_earthquake geography
521644499911847936	utter say alter defence military force organization be helpful
204045402654253056	disease shock_(circulatory) short metropolis Brescia comune City geological_phenomenon earthquake geophysics energy natural_disaster geology phenomenon oscillation astronomy 2010_Haiti_earthquake geography
204045523169193984	perceive listen
520363213532061696	provincial_capital Genoa metropolis comune city_with_hundreds_of_thousands_of_inhabitants port_city City risk Financial_risk land_site dig
1461372851	crisis emergency Rechtsstaat State_of_emergency governance law Stanów Regímenes_de_excepción United_States_Declaration_of_Independence people nation country political_entity Political_division organization terminology Community_(Wales) have info word particularly administrative_division township Civil_township Local_government_in_Pennsylvania Political_division Municipalities_of_Brazil geological_phenomenon earthquake geophysics energy natural_disaster geology phenomenon oscillation astronomy 2010_Haiti_earthquake geography
204044877217013761	little amazement surprise geological_phenomenon earthquake geophysics energy natural_disaster geology phenomenon oscillation astronomy 2010_Haiti_earthquake geography
204051253834166272	pay remit good alone wish desire change damage unfortunate victim geological_phenomenon earthquake geophysics energy natural_disaster geology phenomenon oscillation astronomy 2010_Haiti_earthquake geography
204045163524395009	geological_phenomenon earthquake geophysics energy natural_disaster geology phenomenon oscillation astronomy 2010_Haiti_earthquake geography here move follow tremble shiver
204045841302945793	little Shock_(canción)
1491067956	be close about look feel misfortune disaster event_(philosophy) risk geological_phenomenon earthquake geophysics energy natural_disaster geology phenomenon oscillation astronomy 2010_Haiti_earthquake geography act wait exist indispose hurt
204045278884544512	disease shock_(circulatory) geological_phenomenon earthquake geophysics energy natural_disaster geology phenomenon oscillation astronomy 2010_Haiti_earthquake geography
204044974524862464	now geological_phenomenon earthquake geophysics energy natural_disaster geology phenomenon oscillation astronomy 2010_Haiti_earthquake geography
1460308786	descend crash execute unit_of_time minute unit perceive listen surface face asterid_dicot_genus Emilia genus taxon
204046195826499584	hence comprise tremor aftershock earthquake comprise fairly heavy geological_phenomenon earthquake geophysics energy natural_disaster geology phenomenon oscillation astronomy 2010_Haiti_earthquake geography
204045375999447042	little slam little_slam stroke blow geological_phenomenon earthquake geophysics energy natural_disaster geology phenomenon oscillation astronomy 2010_Haiti_earthquake geography metropolis Bologna comune College_town City
204282734007435265	pour decant activity tears behavior secretion hypocrisy crocodile_tears Affect_display crocodilian crocodile taxon species give pay cost price quantity geological_phenomenon earthquake geophysics energy natural_disaster geology phenomenon oscillation astronomy 2010_Haiti_earthquake geography
204049803359948801	mental_condition anxiety emotion geological_phenomenon earthquake geophysics energy natural_disaster geology phenomenon oscillation astronomy 2010_Haiti_earthquake geography
204044830605709312	stroke blow prizefighter lightweight jock extra geological_phenomenon earthquake geophysics energy natural_disaster geology phenomenon oscillation astronomy 2010_Haiti_earthquake geography
1462787720	printing publication geological_phenomenon earthquake geophysics energy natural_disaster geology phenomenon oscillation astronomy 2010_Haiti_earthquake geography bird_genus Aquila taxon eagle alter change_over
204044992224837633	geological_phenomenon earthquake geophysics energy natural_disaster geology phenomenon oscillation astronomy 2010_Haiti_earthquake geography execute move dance
1461427707	think create_by_mental_act concoct geological_phenomenon earthquake geophysics energy natural_disaster geology phenomenon oscillation astronomy 2010_Haiti_earthquake geography European_country Italy nation country member_state_of_the_United_Nations member_state_of_the_Council_of_Europe social_state Member_state_of_the_European_Union Parliamentary_republic unitary_state transfer mail clasp embrace assistance support
204044497498284033	hold object souvenir so geological_phenomenon earthquake geophysics energy natural_disaster geology phenomenon oscillation astronomy 2010_Haiti_earthquake geography
520719614213644288	chronological_sequence rain model human actor terpsichorean singer designer measuring_instrument radar device avionics System
1464400264	geological_phenomenon earthquake geophysics energy natural_disaster geology phenomenon oscillation astronomy 2010_Haiti_earthquake geography Italian_region Abruzzi_e_Molise Geographical_feature social_unit team organization group begin metropolis Verona World_Heritage_Site comune City
204044649789267968	here move instance time geological_phenomenon earthquake geophysics energy natural_disaster geology phenomenon oscillation astronomy 2010_Haiti_earthquake geography
1463109811	geological_phenomenon earthquake geophysics energy natural_disaster geology phenomenon oscillation astronomy 2010_Haiti_earthquake geography Italian_region Abruzzi_e_Molise Geographical_feature commonality solidarity baseball_team ball_club jock sportsman adult man male gender human person sex male age Stage_(stratigraphy) football association_football athletics
204049264974897152	stroke blow impressive be look exist change damage structure building house technology architecture architectural_structure Structure construction
204045169274793984	bump jar community settlement human_geographic_territorial_entity terminology geological_phenomenon earthquake geophysics energy natural_disaster geology phenomenon oscillation astronomy 2010_Haiti_earthquake geography
1462213140	geological_phenomenon earthquake geophysics energy natural_disaster geology phenomenon oscillation astronomy 2010_Haiti_earthquake geography month April Gregorian_calendar_month Italian_region Abruzzi_e_Molise Geographical_feature
204032182489063424	earthquake Harmonic_tremor hawk kite name be look exist
204044823060164609	setup still laboratory period night be_able_to rest kip
204092116337557504	earthquake Harmonic_tremor now cost price quantity have_to give pay alone
521180632656138240	speech_act denouncement bishop cardinal minister title profession ministry clergyman episcopate prince comune Bagnasco novel La_ciudad_(novela) municipality town inform betray person politician leader politics human political_science profession Indivíduo
204044807046299650	as_yet doze_off geological_phenomenon earthquake geophysics energy natural_disaster geology phenomenon oscillation astronomy 2010_Haiti_earthquake geography
521785733389242370	object souvenir meteo be remain weekday Tuesday day_of_the_week period forenoon time
204044883302948864	interval third music amazement surprise here property age asterid_dicot_genus Emilia genus taxon
1470953106	instance time good exist unfortunate victim wounded
204044967650394112	contact impact event_(philosophy) force shock now metropolis Bologna comune College_town City geological_phenomenon earthquake geophysics energy natural_disaster geology phenomenon oscillation astronomy 2010_Haiti_earthquake geography
204045000495992832	property manner method_(computer_programming) move follow tremble shiver geological_phenomenon earthquake geophysics energy natural_disaster geology phenomenon oscillation astronomy 2010_Haiti_earthquake geography
204030691464331264	perceive feel geological_phenomenon earthquake geophysics energy natural_disaster geology phenomenon oscillation astronomy 2010_Haiti_earthquake geography exist indispose hurt
204045166837903360	as_yet so drinker drunk geological_phenomenon earthquake geophysics energy natural_disaster geology phenomenon oscillation astronomy 2010_Haiti_earthquake geography
204045155299377153	illness disease time present location here Comics geographic_point epicenter exact geological_phenomenon earthquake geophysics energy natural_disaster geology phenomenon oscillation astronomy 2010_Haiti_earthquake geography
204044734417747969	new disease shock_(circulatory) faint
204220271031365633	geological_phenomenon earthquake geophysics energy natural_disaster geology phenomenon oscillation astronomy 2010_Haiti_earthquake geography inform describe crisis emergency change damage
204044985383919616	sexual_intercourse fuck word new geological_phenomenon earthquake geophysics energy natural_disaster geology phenomenon oscillation astronomy 2010_Haiti_earthquake geography
204048285906894848	move vacillation new understand idea suggestion
204091432213037056	furniture bed bedroom_furniture geological_phenomenon earthquake geophysics energy natural_disaster geology phenomenon oscillation astronomy 2010_Haiti_earthquake geography period night exist cause effect change damage
204044111647481856	doze_off
204048066771296256	geological_phenomenon earthquake geophysics energy natural_disaster geology phenomenon oscillation astronomy 2010_Haiti_earthquake geography know perceive listen
1460827508	representation image Artifact_(error) Live_album Vivo_(Ricardo_Arjona_album) geological_phenomenon earthquake geophysics energy natural_disaster geology phenomenon oscillation astronomy 2010_Haiti_earthquake geography
204048455499390977	comprise strong comprise tremor aftershock earthquake geological_phenomenon earthquake geophysics energy natural_disaster geology phenomenon oscillation astronomy 2010_Haiti_earthquake geography
204045098126807041	geological_phenomenon earthquake geophysics energy natural_disaster geology phenomenon oscillation astronomy 2010_Haiti_earthquake geography metropolis Bologna comune College_town City considerable community settlement human_geographic_territorial_entity terminology time moment
1463713193	period forenoon time month April Gregorian_calendar_month comune Viale collect body_fluid blood crisis emergency geological_phenomenon earthquake geophysics energy natural_disaster geology phenomenon oscillation astronomy 2010_Haiti_earthquake geography
204047969408921601	emotion fear unit_of_time second unit SI_base_unit stroke blow pedestrian reeler strong unit_of_time hour unit time high_time size distance navigation length physical_quantity geometry function physics mathematics
